{
  "language": "FR",
  "cover_letter": {
    "subject": "Candidature au stage « Analyste IT Fixed Income H/F » – Réf. 2026-116578",
    "salutation": "Madame, Monsieur,",
    "paragraphs": [
      "Élève ingénieur en dernière année à l'ENSEIRB-MATMECA (Bordeaux INP, Informatique, Data & IA) et en double diplôme avec le Master 2 IREF – Finance quantitative et actuariat de l'Université de Bordeaux, je vous adresse ma candidature au stage d'Analyste IT Fixed Income au sein de Capital Markets IT, dans la filière Bonds. Je recherche un stage de fin d'études de 6 mois, du 1er mars au 31 août 2027. Votre mission, à la croisée du développement Python, des chaînes de pricing et de la réconciliation entre PnL et risques, correspond précisément au profil que je construis entre informatique et finance de marché.",
      "Mes deux stages m'ont appris à fiabiliser des flux de données au service d'utilisateurs exigeants. Chez Société Générale à Casablanca, comme Data Analyst – Finance de marché, j'ai intégré 6 sources de données en flux automatisés et contrôlés (Python, SQL) alimentant les outils de P&L, et mis en place plus de 25 contrôles automatisés de qualité des données et de conformité, suivis par des reportings Power BI pour les équipes Finance, Risques et Trading. Chez Inside Therapeutics, j'ai conçu et développé seul la plateforme LabData (Python, SQL, Streamlit), en production en 7 semaines, avec une validation indépendante des calculs : réconciliation, piste d'audit, documentation et 4 123 tests automatisés. Ces expériences rejoignent directement vos missions de contrôle de la qualité des données, de réconciliation des prix et d'amélioration de la fiabilité des outils.",
      "Côté finance, mes cours de M2 portent sur les fixed income et produits dérivés, le risque de marché et la finance mathématique. J'ai prolongé ce socle par un projet de pricer obligataire en Python (NumPy, pandas) : construction d'une courbe de taux, calcul du prix, de la duration, du DV01 et des sensibilités par pilier, et PnL Explain vectorisé décomposé en carry, courbe et résidu. Un précédent projet de pricing et de couverture d'options (Black–Scholes, Greeks, delta-hedging, P&L explain, VaR/ES) m'a déjà confronté aux liens entre mesures de risque et PnL que vous souhaitez analyser sur les desks EGB, Inflation et SSA. Enfin, un carnet d'ordres en C++20 développé en équipe de 6 m'a sensibilisé aux enjeux de performance, utiles pour contribuer à l'optimisation des temps de calcul.",
      "Curieux et autonome, j'aimerais mettre ces compétences au service de vos équipes et apprendre au contact de la filière Bonds de Global Markets Division. Je serais heureux de vous exposer plus en détail ma motivation lors d'un entretien."
    ],
    "closing": "Je vous prie d'agréer, Madame, Monsieur, l'expression de mes salutations distinguées.\n\nIhab Jaouad\nihab.jaouad5@gmail.com · +33 6 25 58 61 88"
  },
  "linkedin_connection": "Bonjour, élève ingénieur ENSEIRB-MATMECA et M2 Finance quantitative, je m'intéresse au stage Analyste IT Fixed Income chez CACIB. Ravi d'échanger avec vous ! Ihab Jaouad",
  "recruiter_message": "Bonjour,\nJe suis élève ingénieur à l'ENSEIRB-MATMECA (Informatique, Data & IA), en double diplôme avec le M2 IREF – Finance quantitative de l'Université de Bordeaux.\nJe candidate au stage Analyste IT Fixed Income (réf. 2026-116578), pour 6 mois du 1er mars au 31 août 2027.\nChez Société Générale, j'ai intégré 6 sources de données (Python, SQL) alimentant les outils de P&L et automatisé plus de 25 contrôles de qualité des données.\nJ'ai aussi réalisé un pricer obligataire en Python (DV01, sensibilités par pilier, PnL Explain).\nSeriez-vous disponible pour un bref échange ?\nBien cordialement, Ihab Jaouad",
  "application_email": {
    "subject": "Candidature – Stage Analyste IT Fixed Income H/F – Réf. 2026-116578 – Ihab Jaouad",
    "body": "Madame, Monsieur,\n\nÉlève ingénieur en dernière année à l'ENSEIRB-MATMECA (Informatique, Data & IA), en double diplôme avec le Master 2 IREF – Finance quantitative et actuariat de l'Université de Bordeaux, je vous adresse ma candidature au stage d'Analyste IT Fixed Income (réf. 2026-116578), pour un stage de fin d'études de 6 mois du 1er mars au 31 août 2027.\n\nChez Société Générale (Data Analyst – Finance de marché), j'ai intégré 6 sources de données en flux automatisés et contrôlés (Python, SQL) alimentant les outils de P&L et mis en place plus de 25 contrôles automatisés de qualité des données et de conformité. Chez Inside Therapeutics, j'ai conçu seul une plateforme Python / SQL / Streamlit avec réconciliation, piste d'audit et tests automatisés. J'ai par ailleurs réalisé un pricer obligataire en Python (courbe de taux, duration, DV01, sensibilités par pilier, PnL Explain).\n\nVous trouverez ci-joint mon CV et ma lettre de motivation. Je me tiens à votre disposition pour un entretien.\n\nJe vous prie d'agréer, Madame, Monsieur, l'expression de mes salutations distinguées.\n\nIhab Jaouad\nihab.jaouad5@gmail.com\n+33 6 25 58 61 88"
  },
  "facts_used": [
    "Diplôme d'ingénieur ENSEIRB-MATMECA (Bordeaux INP) – Informatique, Data & IA, 2024-2027, en cours",
    "Master 2 IREF – Finance quantitative et actuariat, Université de Bordeaux, double diplôme avec l'ENSEIRB-MATMECA, 2026-2027, en cours",
    "Disponibilité : stage de 6 mois du 1er mars au 31 août 2027",
    "Cours M2 (en cours) : fixed income et produits dérivés, risque de marché, finance mathématique",
    "Société Générale, Casablanca, Data Analyst – Finance de marché : intégration de 6 sources de données (Python, SQL) en flux automatisés et contrôlés alimentant les outils de P&L",
    "Société Générale : plus de 25 contrôles automatisés de qualité des données et de conformité, reportings et dashboards Power BI pour les équipes Finance, Risques et Trading",
    "Inside Therapeutics : LabData conçu et développé seul (Python, SQL, Streamlit), en production en 7 semaines",
    "Inside Therapeutics : validation indépendante des calculs, réconciliation, piste d'audit, documentation, 4 123 tests",
    "Projet proposé pour l'offre (à réaliser avant envoi) : Pricer obligataire et réconciliation PnL/risques – Python, NumPy, pandas (courbe de taux, prix, duration, DV01, sensibilités par pilier, PnL Explain carry/courbe/résidu vectorisé)",
    "Projet 5.1 : pricing, couverture et risques d'options (Black–Scholes, Greeks, delta-hedging, P&L explain, VaR/ES)",
    "Projet 5.2 : carnet d'ordres en C++20, équipe de 6",
    "Coordonnées : ihab.jaouad5@gmail.com, +33 6 25 58 61 88"
  ],
  "warnings": [
    "Date de début : l'offre indique une prise de fonction au 01/02/2027, alors qu'Ihab est disponible du 1er mars au 31 août 2027. Vérifier si le recruteur accepte un début en mars avant d'envoyer (la lettre mentionne mars-août).",
    "Le pricer obligataire est un projet proposé : il doit être réalisé (et marqué réalisé dans l'app) avant l'envoi ; aucun chiffre de résultat n'est cité. Le relire pour que la description de la lettre corresponde au code final.",
    "C#, Linux scripting et VBA sont des compétences requises : aucune preuve dans les faits vérifiés (VBA listé sans preuve, Linux listé comme outil, C# absent hors du projet proposé de contrôles de prix en C#/Bash). La lettre ne les revendique pas ; si Ihab réalise le projet C#/Bash, il peut l'ajouter au 3e paragraphe.",
    "Lieu : Montrouge (92) alors que la scolarité 2026-2027 est à Bordeaux ; être prêt à confirmer la disponibilité en Île-de-France dès mars 2027.",
    "Carnet d'ordres C++20 (équipe de 6) : préparer la contribution individuelle, point probable en entretien.",
    "Chiffres à défendre : 4 123 tests (type de tests, outil de couverture), « en production en 7 semaines », plus de 25 contrôles à SG (exemples concrets, ce qu'était un outil de P&L).",
    "SG : ne pas présenter le stage comme « front office » ; la lettre parle d'outils de P&L, sans P&L explain réalisé chez SG.",
    "Le message LinkedIn utilise l'abréviation « CACIB » pour tenir en 200 caractères ; trouver le bon destinataire manuellement (aucune automatisation LinkedIn).",
    "Le message recruteur et l'e-mail n'ont pas de destinataire nominatif (inconnu) ; adapter la formule d'appel si un nom est connu. Rien n'a été envoyé."
  ]
}